{
  "$schema": "../../../schemas/specs.schema.json",
  "meta": {
    "key": "LIB-101",
    "title": "Renew a loan online",
    "fullTitle": "Renew a loan online (members at home, staff at the desk)",
    "version": "1.2",
    "date": "2026-10-20",
    "status": "Awaiting product owner approval",
    "approvedBy": "",
    "approvedOn": "",
    "related": [
      {
        "label": "Lending policy of the library",
        "path": "docs/lending-policy.md"
      },
      {
        "label": "Email templates",
        "path": "docs/email-templates.md"
      }
    ],
    "precedence": "This document is the requirements baseline of LIB-101. Where the lending policy describes renewals differently, this document wins."
  },
  "sections": [
    {
      "id": "document-control",
      "title": "Document control",
      "body": "**Status of a criterion.** Every acceptance criterion (AC) has one status:\n\n| Status | Meaning |\n|---|---|\n| Draft | Not decided yet. |\n| Not yet implemented | The product owner decided the behaviour. It is not built yet. |\n| Implemented | The behaviour is built and was verified against the system on 2026-10-16. |\n| Known limitation | An accepted deviation. Section 8 describes it. |\n| Non-binding target | Only for AC-11. It becomes binding once the open question Q-LOAN-02 is answered. |\n\n**IDs.** `AC-` IDs and their sub-IDs (for example `AC-02a`), `RULE-LOAN-`, `EX-LOAN-`, `ASM-LOAN-` and `R-LOAN-` IDs are stable. Tests refer to them. Withdrawn IDs are listed in Appendix A2 and are never reused.\n\n`KL-` IDs number the known limitations of this document. A parent AC keeps its full meaning, and its sub-ACs refine parts of it.",
      "list": "meta"
    },
    {
      "id": "description",
      "title": "1. Description",
      "body": "Library members want to renew a loan themselves, at home, instead of coming to the desk. Today only a [[staff-member]] can renew a [[loan]].\n\nLIB-101 adds the button \"Renew\" to the list of loans in the member account. A renewal moves the [[due-date]] to a later day if the library's rules allow it, and tells the [[member]] the reason if they do not. Staff get the same button at the desk, with two exceptions to the rules."
    },
    {
      "id": "scope",
      "title": "2. Scope",
      "body": "**In scope**\n- Renewing one loan at a time, by a member or by a staff member.\n- The rules that allow or refuse a renewal, and the message that names the reason.\n- The confirmation email.\n\n**Out of scope**\n- Renewing several loans at once.\n- Paying fees. A suspended [[member]] pays at the desk.\n- Changing the [[loan-period]] of a [[title]]."
    },
    {
      "id": "terms",
      "title": "3. Terms",
      "body": "The terms are defined once, in the shared terms file, and linked from here. The list shows the terms this specification relies on.",
      "list": "terms"
    },
    {
      "id": "roles",
      "title": "4. Roles and rights per action",
      "body": "| Action | Member (active) | Member (suspended) | Staff member |\n|---|---|---|---|\n| See own loans | yes | yes | yes, of any member |\n| Renew a loan within all rules | yes | no | yes |\n| Renew beyond the [[renewal-limit]] | no | no | yes |\n| Renew an [[overdue-loan]] after the [[grace-period]] | no | no | yes |\n| Renew a loan with a [[reservation]] by another member | no | no | no |"
    },
    {
      "id": "reference-data",
      "title": "5. Reference data set",
      "body": "All examples and test cases use these data. **Today is 2026-03-10.** Dates are in the library's time zone.",
      "list": "data",
      "after": "The reservations and loans above are set up fresh for every test. A test only changes the data of the loan it renews."
    },
    {
      "id": "rules",
      "title": "6. Business rules and examples",
      "body": "Each rule has at least one example. The examples use the reference data set.",
      "list": "rules"
    },
    {
      "id": "acceptance-criteria",
      "title": "7. Acceptance criteria",
      "body": "The scenarios are written in Gherkin, so they can be copied into a test tool.",
      "list": "acceptanceCriteria"
    },
    {
      "id": "known-limitations",
      "title": "8. Known limitations",
      "body": "",
      "list": "limitations"
    },
    {
      "id": "assumptions",
      "title": "9. Assumptions",
      "body": "",
      "list": "assumptions"
    },
    {
      "id": "risks",
      "title": "10. Acceptance risks",
      "body": "Likelihood and impact are rated 1 (low) to 3 (high).",
      "list": "risks"
    },
    {
      "id": "traceability",
      "title": "11. Traceability",
      "body": "Generated from the stories and acceptance criteria.",
      "list": "traceability"
    },
    {
      "id": "test-cases",
      "title": "12. Test cases",
      "body": "The test cases cover the acceptance criteria. Each lists the rules and examples it uses.",
      "list": "testCases",
      "after": "### 12.1 Entry and exit criteria\n\n**Entry**\n- The build is deployed to the test environment, with the reference data set loaded.\n- The email server of the test environment is reachable.\n\n**Exit**\n- Every test case of priority High has passed.\n- No open defect of severity High."
    },
    {
      "id": "open-questions",
      "title": "13. Open questions",
      "body": "",
      "list": "questions"
    },
    {
      "id": "decision-log",
      "title": "Appendix A — Decision log",
      "body": "",
      "list": "decisions",
      "after": "**ID changes in version 1.1:** the reservation rule (RULE-LOAN-03) now says \"another member\". Earlier text did not exclude a member's own reservation."
    },
    {
      "id": "withdrawn-ids",
      "title": "Appendix A2 — Withdrawn IDs",
      "body": "These IDs were used in earlier versions. They are not reused.",
      "list": "withdrawn"
    }
  ],
  "terms": [
    "copy",
    "title",
    "loan",
    "loan-period",
    "due-date",
    "overdue-loan",
    "grace-period",
    "renewal",
    "renewal-limit",
    "reservation",
    "member",
    "member-status",
    "staff-member"
  ],
  "dataKinds": [
    {
      "id": "member",
      "label": "Member",
      "title": "Members",
      "columns": [
        "Status",
        "Email",
        "Note"
      ],
      "derived": [
        {
          "title": "Loans",
          "kind": "loan",
          "column": "Member"
        }
      ]
    },
    {
      "id": "title",
      "label": "Title",
      "title": "Titles",
      "columns": [
        "Name",
        "Loan period",
        "Note"
      ],
      "derived": [
        {
          "title": "Copies",
          "kind": "copy",
          "column": "Title"
        }
      ]
    },
    {
      "id": "copy",
      "label": "Copy",
      "title": "Copies",
      "columns": [
        "Title",
        "Note"
      ]
    },
    {
      "id": "loan",
      "label": "Loan",
      "title": "Loans",
      "columns": [
        "Member",
        "Copy",
        "Due date",
        "Renewals",
        "Note"
      ]
    },
    {
      "id": "reservation",
      "label": "Reservation",
      "title": "Reservations",
      "columns": [
        "Title",
        "Member",
        "Note"
      ]
    }
  ],
  "data": [
    {
      "id": "MEM-1",
      "kind": "member",
      "values": {
        "Status": "active",
        "Email": "anna@example.org",
        "Note": "Anna, the main example member."
      }
    },
    {
      "id": "MEM-2",
      "kind": "member",
      "values": {
        "Status": "active",
        "Email": "ben@example.org",
        "Note": "Ben"
      }
    },
    {
      "id": "MEM-3",
      "kind": "member",
      "values": {
        "Status": "suspended",
        "Email": "carla@example.org",
        "Note": "Carla, unpaid fees"
      }
    },
    {
      "id": "MEM-4",
      "kind": "member",
      "values": {
        "Status": "active",
        "Email": "desk@example.org",
        "Note": "Dev, a staff member at the desk"
      }
    },
    {
      "id": "MEM-5",
      "kind": "member",
      "values": {
        "Status": "active",
        "Note": "Eve, has no email address on file"
      },
      "testOnly": true
    },
    {
      "id": "TI-1",
      "kind": "title",
      "values": {
        "Name": "Novel",
        "Loan period": "21 days"
      }
    },
    {
      "id": "TI-2",
      "kind": "title",
      "values": {
        "Name": "DVD",
        "Loan period": "7 days"
      }
    },
    {
      "id": "TI-3",
      "kind": "title",
      "values": {
        "Name": "Atlas",
        "Loan period": "14 days"
      }
    },
    {
      "id": "TI-4",
      "kind": "title",
      "values": {
        "Name": "Cookbook",
        "Loan period": "21 days"
      }
    },
    {
      "id": "TI-5",
      "kind": "title",
      "values": {
        "Name": "Poetry collection",
        "Loan period": "21 days"
      }
    },
    {
      "id": "CP-1",
      "kind": "copy",
      "values": {
        "Title": "TI-1"
      }
    },
    {
      "id": "CP-2",
      "kind": "copy",
      "values": {
        "Title": "TI-1"
      }
    },
    {
      "id": "CP-3",
      "kind": "copy",
      "values": {
        "Title": "TI-2"
      }
    },
    {
      "id": "CP-4",
      "kind": "copy",
      "values": {
        "Title": "TI-3"
      }
    },
    {
      "id": "CP-5",
      "kind": "copy",
      "values": {
        "Title": "TI-1"
      }
    },
    {
      "id": "CP-6",
      "kind": "copy",
      "values": {
        "Title": "TI-4"
      }
    },
    {
      "id": "CP-7",
      "kind": "copy",
      "values": {
        "Title": "TI-2"
      }
    },
    {
      "id": "CP-8",
      "kind": "copy",
      "values": {
        "Title": "TI-2"
      }
    },
    {
      "id": "CP-9",
      "kind": "copy",
      "values": {
        "Title": "TI-5"
      }
    },
    {
      "id": "CP-10",
      "kind": "copy",
      "values": {
        "Title": "TI-3"
      }
    },
    {
      "id": "LN-1",